{
  "$schema": "https://json-schema.org/draft/2020-12/schema",
  "$id": "https://schemas.sovereignops.local/docs.schema.json",
  "title": "Doc record",
  "type": "object",
  "additionalProperties": false,
  "required": [
    "id",
    "workspaceId",
    "status",
    "risk",
    "createdAt",
    "updatedAt",
    "title",
    "ownerActorId"
  ],
  "properties": {
    "id": {
      "type": "string",
      "pattern": "^doc_[A-Za-z0-9_-]{1,88}$"
    },
    "workspaceId": {
      "type": "string",
      "pattern": "^wsp_[A-Za-z0-9_-]{1,88}$"
    },
    "status": {
      "type": "string",
      "enum": [
        "draft",
        "review",
        "active",
        "archived"
      ]
    },
    "risk": {
      "type": "string",
      "enum": [
        "low",
        "medium",
        "high"
      ]
    },
    "createdAt": {
      "type": "string",
      "minLength": 1,
      "pattern": "\\S"
    },
    "updatedAt": {
      "type": "string",
      "minLength": 1,
      "pattern": "\\S"
    },
    "projectId": {
      "type": "string",
      "pattern": "^prj_[A-Za-z0-9_-]{1,88}$"
    },
    "title": {
      "type": "string",
      "minLength": 1,
      "pattern": "\\S"
    },
    "body": {
      "type": "string",
      "minLength": 1,
      "pattern": "\\S"
    },
    "ownerActorId": {
      "type": "string",
      "pattern": "^act_[A-Za-z0-9_-]{1,88}$"
    }
  }
}
